Date,BrandName,ProductName,Reason,Company
2013-01-28T00:00:00.0000000,ReCharge,Chia ReCharged Stix Mix ,Undeclared Peanuts,Tropical Nut and Fruit Co
2013-01-25T00:00:00.0000000,Whole Catch,Alaskan Sockeye Salmon ,Listeria monocytogenes,Whole Foods Market
2013-01-25T00:00:00.0000000,Hospira,"Lactated Ringers and 5% Dextrose Injection, USP ",May contain spore like particulate,"Hospira, Inc."
2013-01-24T00:00:00.0000000,Super Power,Dietary Supplement ,Unapproved new drug,"D&S Herbals, LLC, d/b/a Freedom Trading"
2013-01-23T00:00:00.0000000,Hunt's,Tomato Sauce ,Defect in inner lining of cans causes the cans to swell,ConAgra Foods
2013-01-22T00:00:00.0000000,Annie's,Frozen pizza products ,Metal fragments,Annie’s Inc.
2013-01-21T00:00:00.0000000,Knott's Fine Foods Inc.,Chicken Salad Sandwiches ,Listeria monocytogenes,Knott's Fine Foods Inc.
2013-01-17T00:00:00.0000000,Rugby,"Ferrous Sulfate Tablets, 325 mg ","Bottle of Ferrous Sulfate Tablets, 325 mg, may actually contain Meclizine HCl 25 mg tablets",Advance Pharmaceutical Inc.
2013-01-17T00:00:00.0000000,Kinnikinnick,Frozen Pie Crust ,Undeclared eggs,Kinnikinnick Foods
2013-01-16T00:00:00.0000000,"Thomas', Sara Lee, Publix and Weight Watchers",Bagels ,Metal fragments,"BBU, Inc."
2013-01-15T00:00:00.0000000,Dymatize Nutrition,Cookies & cream bars and brownie bars ,Undeclared peanuts,Belmont Confections Inc.
2013-01-15T00:00:00.0000000,Homestead Creamery,Artisan Cheeses ,"Contaminated with Shiga-Toxin producing E.coliHomestead Creamery01/11/2013Island Delights Haystacks Undeclared milkIsland Delights, Inc.01/10/2013Mitosol Mitomycin for solution May be non-sterileMobiusTherapeutics, LLC01/09/2013Royal Fjord, Pacific Supreme, Icy Point, more Cold smoked fish products Listeria monocytogenesDelifish01/09/2013Boba Direct (BD) Flavored powders Undeclared milkBoba Direct (BD)01/09/2013Milo's Kitchen Chicken Jerky and Chicken Grillers home-style dog treats Unapproved antibiotics found in finished productMilo's Kitchen01/08/2013Somersault Snack Undeclared milkSomersault Snack Co., LLC01/08/2013Woodstock Almonds Undeclared soyWoodstock01/07/2013ShurFine Ice Cream Undeclared soy, pecan, and wheatSouthwest Ice Cream Specialties01/07/2013Nathan's, Lascco Smoked Salmon Listeria monocytogenesGiant Food Stores, LLC and Martin's Food Markets01/04/2013Andy Capp's Hot Fries Snack Undeclared soyConAgra Foods01/03/2013Food Club Brownie Mix Undeclared WalnutsGilster-Mary LeePrevious1234567891011121314Next
 -  -  -  -  -  Page Last Updated: 04/04/2017 
 Note: If you need help accessing information in different file formats, see Instructions for Downloading Viewers and Players.
 Language Assistance Available: Español | 繁體中文 | Tiếng Việt | 한국어 | Tagalog | Русский | العربية | Kreyòl Ayisyen | Français | Polski | Português | Italiano | Deutsch | 日本語 | فارسی | EnglishAccessibilityContact FDACareersFDA BasicsFOIANo FEAR ActSite MapNondiscriminationWebsite PoliciesU.S. Food and Drug Administration 10903 New Hampshire Avenue 
 Silver Spring, MD 20993 
 Ph. 1-888-INFO-FDA (1-888-463-6332)
Contact FDAFor GovernmentFor PressCombination ProductsAdvisory CommitteesScience & ResearchRegulatory InformationSafetyEmergency PreparednessInternational ProgramsNews & EventsTraining and Continuing EducationInspections/ComplianceState & Local OfficialsConsumersIndustryHealth ProfessionalsFDA Archive Links on this page:",Homestead Creamery
2014-12-31T00:00:00.0000000,Whole Foods,Cheeses ,Listeria monocytogenes,Whole Foods Market
2014-12-31T00:00:00.0000000,Jump Your Bones,Pet treats ,Salmonella,"Jump Your Bones, Inc."
2014-12-31T00:00:00.0000000,Private Selection,Bread crumbs and breader ,"Undeclared peanuts, Undeclared Peanut (from Cumin Ingredient)","Adams Flavors, Foods & Ingredients"
2014-12-31T00:00:00.0000000,Virazole,ribavirin powder for solution ,Microbial Contamination,Valeant Pharmaceuticals North America LLC
2014-12-30T00:00:00.0000000,"Buff Ewe Blue, Buff Blue, Double Down Blue and more",Cheeses ,Listeria monocytogenes,Bleating Heart Cheese (BHC)
2014-12-30T00:00:00.0000000,Fisher,Chopped walnuts and Pecan Cookie Pieces ,Salmonella,"John B. Sanfilippo & Son, Inc."
2014-12-30T00:00:00.0000000,Tommy’s Superfoods,Santa Fe Rice ,Undeclared peanuts,TEN BC LLC
2014-12-30T00:00:00.0000000,Pink’s,Ice Cream ,Listeria monocytogenes,Pink’s Ice Cream LLC
2014-12-29T00:00:00.0000000,Merb’s,Caramel apples ,Listeria monocytogenes,Merbs Candies
2014-12-29T00:00:00.0000000,"DL Jardines, Shotgun Willie’s",Chili Mix Products ,Undeclared peanuts,"Jardine Foods, Inc."
2014-12-29T00:00:00.0000000,Roland,Bruschetta ,May contain pieces of glass,American Roland Food Corp.
2014-12-29T00:00:00.0000000,Groove,Ice Cream Sandwiches ,Listeria monocytogenes,"Great Feeling Foods, LLC"
2014-12-27T00:00:00.0000000,California Snack Foods,Caramel apples ,Listeria monocytogenes,California Snack Foods
2014-12-26T00:00:00.0000000,"Adams, Earl Campbell",Cumin products ,"Undeclared peanut protein, Undeclared Peanut (from Cumin Ingredient)","Adams Flavors, foods & Ingredients"
2014-12-24T00:00:00.0000000,Happy Apple,Caramel apples ,Listeria monocytogenes,Happy Apple Company
2014-12-24T00:00:00.0000000,Farm Country Cheese House,Raw Milk Cheddar ,Listeria monocytogenes,Farm Country Cheese House
2014-12-24T00:00:00.0000000,Barkworthies,Chicken Vittles dog chews ,Salmonella,Barkworthies
2014-12-23T00:00:00.0000000,Hospira,MitoXANTRONE ,Due to confirmed subpotency and elevated impurity levels.,Hospira Inc.
2014-12-23T00:00:00.0000000,"Snoqualime, Emerald & Spruce, and Top Pot.","Ice Cream, Gelato, Custard and Sorbet ",Listeria monocytogenes,"Snoqualmie Gourmet Ice Cream, Inc."
2014-12-23T00:00:00.0000000,Elevated Ice Cream,Ice Cream ,Listeria monocytogenes,Elevated Ice Cream
2014-12-22T00:00:00.0000000,Haggen brand for Thai Noodle Salad. No brand for Tofu Pad Thai Bowl.,Tofu Pad Thai Bowl and Thai Noodle Salad ,Undeclared Shellfish (Shrimp),"Real Foods of Seattle, LLC"
2014-12-19T00:00:00.0000000,Winter Blossom; Kkot Saem Winter Blossom and Kkot Saem,Soybean Sprouts and Mungbean Sprouts ,Listeria monocytogenes,"Kkot Saem Sprouts, Inc."
2014-12-19T00:00:00.0000000,SLIM-K,Dietary supplement capsules used for weight loss ,Undeclared Drug Ingredient,"Bethel Nutritional Consulting, Inc."
2014-12-19T00:00:00.0000000,B-Lipo,Dietary supplement capsules used for weight loss ,Undeclared Drug Ingredient,"Bethel Nutritional Consulting, Inc."
2014-12-19T00:00:00.0000000,Carroll Shelby and Wick Fowler,Chili Seasoning Kits ,Undeclared Peanuts and Almonds,Reily Foods Co.
2014-12-19T00:00:00.0000000,Market Pantry,Dark Chocolate Covered Almonds ,Undeclared Peanuts,"Zachary Confections, Inc."
2014-12-19T00:00:00.0000000,Perfect Bar,Peanut Butter and Cranberry Crunch Nutrition Bars ,Salmonella contamination,Perfect Bar & Company
2014-12-17T00:00:00.0000000,Bleating Heart Cheese,Ewelicious Blue; Fat Bottom Girl; Goldette Tommette ,Listeria monocytogenes,Bleating Heart Cheese LLC.
2014-12-12T00:00:00.0000000,Wyked Labs and Anabolic Science Labs,Dietary supplement capsules used for body building and weight loss ,Undeclared Synthetic Hormone/Prohormone Ingredient,Wyked Labs
2014-12-12T00:00:00.0000000,Gastrotec,Combination of Omeprazole and Misoprostol in a paste ,Not approved for use as an animal drug,"Tristar Equine Marketing, LLC."
2014-12-11T00:00:00.0000000,Flat Creek Lodge,Gouda Cheese ,Salmonella,Flat Creek Farm & Dairy
2014-12-11T00:00:00.0000000,Giant Eagle,Apple Pistachio Salad (with/without chicken) ,Listeria monocytogenes,Giant Eagle
2014-12-11T00:00:00.0000000,Baxter,0.9% Sodium Chloride Injection USP ,Contains Particulate Matter,Baxter International Inc.
2014-12-10T00:00:00.0000000,"Farmers Market - Giant Eagle, Del Monte, Nature Made, Wegmans, Sheetz M-T-go!, 7-Eleven",Fresh Cut Red Apples ,Listeria monocytogenes,"Del Monte Fresh Produce N.A., Inc."
2014-12-10T00:00:00.0000000,Burkmann Feeds,Poultry feed ,Contaminated with Monensin Sodium,Burkmann Feeds
2014-12-09T00:00:00.0000000,De Mi Pais,Cuajada Fresca (fresh curd) and Cuajada Olanchana (fresh curd) ,Listeria monocytogenes,Global Garlic Inc.
2014-12-09T00:00:00.0000000,Whalens,Seafood & Burger Sauce ,Undeclared fish (anchovy),"Whalens Horseradish Products, Inc."
2014-12-08T00:00:00.0000000,Alere INRatio,"INRatio Monitor, INRatio2 Monitor, and INRatio Test Strips ",May provide an INR result that is clinically significantly lower than a result obtained using a reference INR system for patients with certain medical conditions,Alere Inc.
2014-12-06T00:00:00.0000000,Safeway Select,French Salted Caramel (Fleur De Sel) Premium Ice Cream ,Undeclared Peanuts,Safeway
2014-12-04T00:00:00.0000000,Abdallah Candies,Holiday Caramel Bites ,Undeclared Peanuts,Abdallah Candies of Burnsville
2014-12-03T00:00:00.0000000,Open Nature,Open Nature Chile Cheese Enchiladas ,Salmonella,"Overhill Farms, Inc."
2014-12-03T00:00:00.0000000,Lakeland Animal Nutrition,Horse feed ,May contain monensin and lasalocid,Lakeland Animal Nutrition
2014-12-01T00:00:00.0000000,Whole Foods Market,Tarte Aux Pommes ,Undeclared almonds,Whole Foods Market
2014-12-01T00:00:00.0000000,Ciao Bella,Dark Cocoa Sorbetto ,Undeclared Dairy,"House of Flavors, Inc."
2014-11-26T00:00:00.0000000,Whole Foods,Vegan Pumpkin Pie ,Undeclared Walnuts,Whole Foods Market
2014-11-26T00:00:00.0000000,Heart Sync,Multi-function Defibrillation Electrodes ,Electrodes will not connect with Philips FR3 or FRx AED units.,Heart Sync Inc.
2014-11-25T00:00:00.0000000,CONMED,(CONMED) PadPro and R2 Multi-function Defibrillation Electrodes ,Due to a connector compatibility issue with Philips FR3 and FRx Defibrillator Units.,CONMED Corporation
2014-11-24T00:00:00.0000000,EVO,Pet Food ,Insufficient levels of vitamins and excess minerals,Natura Pet Products
2014-11-24T00:00:00.0000000,North Star,"Gabapentin Capsules, USP 300mg ",Empty capsules,"Aurobindo Pharma USA, Inc."
2014-11-24T00:00:00.0000000,Henry's Farm,Soybean Sprouts ,Listeria monocytogenes,"Henry’s Farm, Inc."
2014-11-24T00:00:00.0000000,Private Selection,Denali Extreme Moose Tracks Ice Cream ,Undeclared Peanuts,The Kroger Co.
2014-11-21T00:00:00.0000000,Flying Cow Creamery,Whole milk yogurt ,May not have been adequately pasteurized,Flying Cow Creamery
2014-11-21T00:00:00.0000000,Kozy Shack Simply Well,Chocolate pudding cups ,Undeclared milk and product lacks complete labeling,"Kozy Shack Enterprises, LLC"
2014-11-21T00:00:00.0000000,Customed,Sterile Convenience Surgical Kits ,Potential package integrity defect that may compromise the sterility of the product,"Customed, Inc."
2014-11-20T00:00:00.0000000,Baxter,"Potassium Chloride Injection, 10 mEq per 100 mL ",Mislabeling of the overpouch,Baxter International Inc.
2014-11-20T00:00:00.0000000,Vinacafe,Wake Up Weasel Instant Coffee mix 3-in-1 ,Undeclared Milk and Soy Allergen,Evershing International Trading
2014-11-19T00:00:00.0000000,Forever Beautiful,Dietary Supplement ,Unapproved new drug,"REFA Enterprises, LLC"
2014-11-18T00:00:00.0000000,Acme,Smoked Nova Salmon ,Listeria monocytogenes,Acme Smoked Fish Corporation
2014-11-17T00:00:00.0000000,ABC Dophilus Powder,Dietary Supplement ,Contains Rhizopus oryzae,"Solgar, Inc."
2014-11-14T00:00:00.0000000,Ortega and Las Palmas,"Taco seasoning mix, taco sauce and more ",Undeclared peanut and almond,B&G; Foods
2014-11-14T00:00:00.0000000,HyVee Mozzarella Cheese Sticks,HyVee Mozzarella Cheese Sticks ,"Undeclared soy flour, yellow #5 and yellow #6","Great American Appetizers, Inc."
2014-11-14T00:00:00.0000000,Mayhem dietary supplement capsules,Dietary Supplement ,Unapproved new drug,Chaotic Labz
2014-11-14T00:00:00.0000000,"Children’s Medical Ventures, LLC",Gel-E Donut gel pillow & Squishon 2 gel cushion ,Potential mold contamination,"Children’s Medical Ventures, LLC"
2014-11-14T00:00:00.0000000,Eco-Farmed and Organic Brown Rice Flour,Brown Rice Flour ,Salmonella,Lundberg Family Farms
2014-11-07T00:00:00.0000000,Whole Foods market,Organic Raw Almonds ,Possibly contain elevated levels of naturally occurring hydrogen cyanide,"Marin Foods Specialties, Inc."
2014-11-06T00:00:00.0000000,Schwartz Brothers Bakery,Everything Bagels ,Undeclared milk,Schwartz Brothers Bakery
2014-11-04T00:00:00.0000000,Lacteos Santa Martha,Cheeses en Inglés ,Listeria monocytogenes,"Oasis Brands, Inc."
2014-11-04T00:00:00.0000000,Lacteos Santa Martha,Cheeses en Español ,Listeria monocytogenes,"Oasis Brands, Inc."
2014-11-03T00:00:00.0000000,Laxmi Nutkhhat Golden Raisins,Flavored raisins ,Undeclared Sulfites,House of Spices Inc.
2014-11-02T00:00:00.0000000,Wawa,Garden Rotini Salad ,"Undeclared fish, wheat, and egg","Taylor Farms New Jersey, Inc."
2014-10-31T00:00:00.0000000,"Shurfine, Western Family, HyVee, Market Pantry, Pearâ€™s Gourmet, Cash-Wa Distributing, Pegler Sysco, Mayan Gold",Macadamia nuts ,Salmonella contamination,"Marathon Ventures, Inc"
2014-10-31T00:00:00.0000000,"Bartlett Pasture, Cleveland Carolina Champion",Horse Feeds ,Rumensin contamination,Bartlett Milling Company
2014-10-29T00:00:00.0000000,99 Ranch Market,"Various flavors of toast, packaged as pre-sliced loaves in clear plastic bags ","Undeclared wheat, soy, and/or and milk","Welcome Market, Inc. (doing business as 99 Ranch Market)"
2014-10-27T00:00:00.0000000,Deep Raw Cashew Pieces,Cashew Pieces ,Salmonella contamination,Chetak New York
2014-10-26T00:00:00.0000000,Vegan Gingersnap Cookies,Vegan Gingersnap Cookies ,Mislabeling and Undeclared Allergens,Whole Foods
2014-10-25T00:00:00.0000000,"Cuties, Diapers.com, Femtex, Fred's, more",Baby wipes ,Presence of B. cepacia,"Nutek Disposables, Inc."
2014-10-24T00:00:00.0000000,Lundberg Family Farms,Sea Salt Rice Chips ,Undeclared milk,Lundberg Family Farms
2014-10-23T00:00:00.0000000,Lascadoil/Soyoil,Soyoil ,Presence of Lasalocid,Shur-Green Farms
2014-10-22T00:00:00.0000000,IntraVia,Containers ,Particulate Matter,"Baxter International, Inc."
2014-10-22T00:00:00.0000000,Ocean's Catch,Fresh and Frozen Crab Meat ,Listeria monocytogenes,Rome Packing Co.
2014-10-21T00:00:00.0000000,Bailey Farms,Fresh Serrano Chile Peppers ,Salmonella,"Bailey Farms, Inc."
2014-10-21T00:00:00.0000000,Lightly Roasted Organic Carob Powder,Carob Powder ,Presence of Salmonella,Z Natural Foods
2014-10-20T00:00:00.0000000,Assured,Naproxen Sodium tablets ,May contain a different product,"Contract Packaging Resources, Inc."
2014-10-17T00:00:00.0000000,"JFC International, Inc.",Hapi Pudding ,Undeclared milk,"JFC International, Inc."
2014-10-17T00:00:00.0000000,Saba,Shark Cartilage Complex Dietary Supplement ,Salmonella,"AMS Health Sciences, LLC"
2014-10-17T00:00:00.0000000,United Natural Trading LLC dba/ Woodstock Farms Manufacturing and Market Basket,Asian 7 Rice Cracker Mix ,Undeclared peanuts,United Natural Trading LLC dba/ Woodstock Farms Manufacturing
2014-10-17T00:00:00.0000000,Publix,Asian Mix ,Undeclared peanuts,Publix Super Markets
2014-10-16T00:00:00.0000000,"Hospira, Inc.","1% Lidocaine HCI for Injection, USP ",Presence of particulate matter,"Hospira, Inc."
2014-10-16T00:00:00.0000000,New Hope Mills,Gluten Free Chia Pancake and Waffle Mix ,Undeclared soy,New Hope Mills Manufacturing
2014-10-14T00:00:00.0000000,LifeCare,Intravenous solutions ,Container potential for leakage,"Hospira, Inc."
2014-10-12T00:00:00.0000000,"SunBurst Fresh Bites, River Edge Farms, CFW, Southern Zest, more",Sandwiches ,Listeria monocytogenes,SunBurst Foods
2014-10-12T00:00:00.0000000,Real Foods,Mexican Cheddar Dip ,Undeclared egg,"Real Foods of Seattle, LLC,"
2014-10-10T00:00:00.0000000,Williams-Sonoma,Pumpkin seed pesto ,Improper processing,"California Olive and Vine, LLC"
2014-10-10T00:00:00.0000000,"Medi-Trace, Kendall",Defibrillation Electrodes ,Connector compatibility issue with Philips FR3 and FRx Defibrillators,Covidien
2014-10-09T00:00:00.0000000,Lotte,Waffles ,Undeclared egg,"LOTTE Confectionery Co., Ltd."
2014-10-09T00:00:00.0000000,Creative Compounds,Unexpired sterile products ,Lack of sterility assurance,"Oregon Compounding Centers, Inc."
2014-10-07T00:00:00.0000000,Jinga,Anchovies ,Listeria monocytogenes,HAR Maspeth Corp.
2014-10-07T00:00:00.0000000,KUPIEC,Rice Cakes with Dark Chocolate ,Undeclared milk,"J&B; European Distribution, Inc."
2014-10-07T00:00:00.0000000,Hospira,"Vancomycin Hydrochloride for Injection, USP ",Uncontrolled storage during transit,"Hospira, Inc."
2014-10-06T00:00:00.0000000,Cuajada en Hoja,Cuajada en Hoja ,Listeria monocytogenes,"Oasis Brands, Inc."
2014-10-03T00:00:00.0000000,KUPIEC,Rice Cakes with Dark Chocolate ,Undeclared Milk,Markpol Distributors Inc.
2014-10-03T00:00:00.0000000,Sagent Pharmaceuticals,"Ketorolac Tromethamine Injection, USP, 30mg/mL single-dose vials ",Due to labeling the product with the incorrect expiration date/The labeled expiration date is longer than the known stability of the product.,Sagent Pharmaceuticals
2014-10-01T00:00:00.0000000,next by Nature,Dark Chocolate Cherries ,Undeclared Peanuts,"Tropical Valley Foods, Inc."
2014-10-01T00:00:00.0000000,IKEA,1)Elk Shaped Pasta Organic 17.6 oz “PASTAALGAR” 2)Elk Shaped Pasta Wholemeal Organic 17.6 OZ “PASTAALGAR FULLKORN” ,Undeclared Soy,"IKEA North America Services, Inc."
2014-09-26T00:00:00.0000000,Whole Foods Market,Plain Streusel Coffeecake ,Undeclared tree nuts,Whole Foods Market
2014-09-26T00:00:00.0000000,Su Cocina,Pan Molido (Plain Bread Crumbs) ,"Undeclared wheat, whey (milk), and soy",Dominguez Foods of Washington Inc.
2014-09-26T00:00:00.0000000,Bravo!,Pet Food ,Salmonella,Turkey and Chicken dog and cat foods
2014-09-24T00:00:00.0000000,Gold Star Smoked Fish Corp.,Cold smoked steelhead ,Listeria monocytogenes,Gold Star Smoked Fish Corp.
2014-09-24T00:00:00.0000000,The Original Soupman,Lobster bisque ,Undeclared fish and shrimp (crustacea),The Original Soupman
2014-09-22T00:00:00.0000000,Glaser Organic Farm,Raw carob powder and Carob fudgy brownie ,Salmonella,Glaser Organic Farms
2014-09-19T00:00:00.0000000,M&M;'s,Milk chocolates ,Undeclared peanut/outer carton packaging is for milk chocolate; however may contain peanut butter M&Ms.;,Mars Chocolate North America
2014-09-16T00:00:00.0000000,B&L;,Dried Roach (Vobla) Fish ,Potential for Clostridium botulinum growth,S&S; Food Import Corp.
2014-09-16T00:00:00.0000000,Baxter,Potassium Chloride Injection ,Shipping Carton Mislabeling,Baxter
2014-09-15T00:00:00.0000000,Fresh Finds,Ground Black Pepper ,Salmonella,Gel Spice Company
2014-09-12T00:00:00.0000000,Costco/Taylor Farms Pacific and Signature Café,Whole Roma Tomatoes and Sicilian Vegetable Salad Kit ,Salmonella,"Taylor Farms Pacific, Inc."
2014-09-11T00:00:00.0000000,"Hospira, Inc.","Heparin Sodium, 1,000 USP Heparin Units/500 mL (2 USP Heparin Units/mL), in 0.9 percent Sodium Chloride Injection, 500 mL ",Presence of particulate matter,"Hospira, Inc."
2014-09-09T00:00:00.0000000,Golden King Bakery,Coconut bun ,Undeclared eggs,Golden King Bakery
2014-09-09T00:00:00.0000000,Playtex,AC/DC power adapters used with breast pump ,Potential for electric shock,"Playtex Manufacturing, Inc."
2014-09-08T00:00:00.0000000,Tullia's,Italian Meatless Pasta Sauce ,Potential for Clostridium botulinum growth,Tullia's
2014-09-06T00:00:00.0000000,Pharmacy Creations,"Ascorbic Acid, Glutathione, Magnesium Chloride, Tropi/Cyclo/Phenyl/Tobra/Flurb ",Lack of sterility assurance,Pharmacy Creations
2014-09-05T00:00:00.0000000,Little Cremes,Organic Rice Milk Snacks ,Choking Hazard,Plum Organics
2014-09-05T00:00:00.0000000,Twix,Unwrapped chocolate bites ,Undeclared eggs and peanuts,Mars Chocolate North America
2014-09-05T00:00:00.0000000,Publix,Jalapeno bagels ,May contain pieces of glass and small stones,Publix
2014-08-31T00:00:00.0000000,Pedigree,Dog Food ,Presence of foreign material,Mars Petcare US
2014-08-29T00:00:00.0000000,4C Foods,Parmesan Cheese ,Salmonella,4C Foods Corp.
2014-08-29T00:00:00.0000000,Kraft,Cheese ,Temperature Abuse,Kraft Foods Group
2014-08-29T00:00:00.0000000,La Orocovena,Pound Cake Queso ,"Undeclared Milk, Soy, Wheat",La Orocovena Biscuit
2014-08-29T00:00:00.0000000,SAM,Accessory (Axilla) Strap for the SAM Junctional Tourniquet ,Potential for clip failure during repetitive use resulting in delay of procedure,SAM Medical Products
2014-08-28T00:00:00.0000000,DOLE,Bagged Spinach ,Undeclared walnuts,Dole Fresh Vegetables
2014-08-28T00:00:00.0000000,Dermatend,Mole removal ,Unapproved New Drug,"Solace International, Inc."
2014-08-27T00:00:00.0000000,Cloversnare,4-Loop Vascular Retrieval Snare device ,Potential for loop to separate from the shaft,Cook Medical
2014-08-27T00:00:00.0000000,Margaret Holmes,Turnip and Mixed Greens ,Questionable Seals,McCall Farms Incorporated
2014-08-27T00:00:00.0000000,RegeneSlim,Appetite control dietary supplement ,"Presence of 1,3-dimethylamylamine (DMAA), methylhexanamine, or geranium extract","Regeneca Worldwide, a division of VivaCeuticals, Inc."
2014-08-27T00:00:00.0000000,Martin Avenue Pharmacy,All in-date compounded sterile preparations ,Lack of sterility assurance,Martin Avenue Pharmacy
2014-08-26T00:00:00.0000000,Pedigree,Dog Food ,Presence of foreign material,Mars Petcare US
2014-08-25T00:00:00.0000000,TJs Place,Basil Pesto Pasta ,Listeria monocytogenes,TJs Place
2014-08-22T00:00:00.0000000,LEAN CUISINE,Chicken with peanut sauce ,Package Mislabeling/May contain undeclared shrimp.,Nestlé Prepared Foods Company
2014-08-21T00:00:00.0000000,Customed,Hospital Surgical Packs ,Adhesion defect which could result in loss of sterility,"Customed, Inc."
2014-08-19T00:00:00.0000000,"MaraNatha, Whole Foods 365, Trader Joe’s and Others.",Nut butters ,Salmonella,"nSpired Natural Foods, Inc."
2014-08-19T00:00:00.0000000,Cloversnare,4-Loop Vascular Retrieval Snare device ,Potential for loop to separate from the shaft,Cook Medical
2014-08-14T00:00:00.0000000,Dianeal,Peritoneal Dialysis Solution ,Particulate matter,Baxter
2014-08-13T00:00:00.0000000,Aranesp,Darbepoetin alfa in prefilled syringes ,Particulate matter,Amgen
2014-08-13T00:00:00.0000000,McCormick,Ground oregano ,Salmonella,McCormick & Company
2014-08-11T00:00:00.0000000,Sunfood,Carob powder ,Salmonella,Sunfood
2014-08-08T00:00:00.0000000,"Cubist Pharmaceuticals, Inc.",CUBICIN (daptomycin for injection) ,Presence of foreign particulate matter,"Cubist Pharmaceuticals, Inc."
2014-08-07T00:00:00.0000000,RegeneSlim,Appetite control dietary supplement ,"Presence of 1,3-dimethylamylamine (DMAA), methylhexanamine, or geranium extract","Regeneca Worldwide, a division of VivaCeuticals, Inc."
2014-08-06T00:00:00.0000000,"Cubist Pharmaceuticals, Inc.",CUBICIN(daptomycin for injection) ,Presence of glass particulate matter,"Cubist Pharmaceuticals, Inc."
2014-08-04T00:00:00.0000000,Richmond,Ice bar ,Undeclared eggs,Seoul Shik Poom Inc.
2014-08-01T00:00:00.0000000,Vibrant Health,Dietary Supplements: Green Vibrance and Rainbow Vibrance ,Salmonella,New England Greens LLC
2014-08-01T00:00:00.0000000,Sunburst Superfoods,Organic Raw Carob Powder ,Salmonella,Sunburst Superfoods
2014-08-01T00:00:00.0000000,LifeCore,Chocolate ,Undeclared milk,Ortho Molecular Products
2014-07-31T00:00:00.0000000,Lacteos Santa Martha,Quesito Casero (fresh curd) ,Listeria monocytogenes,"Oasis Brands, Inc."
2014-07-31T00:00:00.0000000,Wawona Packing Company,"Whole white and yellow peaches, white and yellow nectarines, plums and pluots ",Listeria monocytogenes,Wawona Packing Company
2014-07-30T00:00:00.0000000,VR Green Farms,Jarred Food Products ,"May have been improperly produced, making them susceptible to contamination with Clostridium botulinum",VR Green Farms
2014-07-29T00:00:00.0000000,Hummingbird Wholesale,Organic Raw Carob Powder ,Salmonella,Hummingbird Wholesale
2014-07-29T00:00:00.0000000,Natural Grocers,CHUNKS OF ENERGY CAROB GREENS and FLAX/TUMERIC ,Salmonella,Natural Grocers
2014-07-29T00:00:00.0000000,"Hospira, Inc.","Lidocaine HCI Injection, USP, 2 percent ",Particles,"Hospira, Inc."
2014-07-28T00:00:00.0000000,Mt Sterling Coop Creamery,Cheese ,Escherichia coli (STEC) O111:H8,SW Wisc Dairy Goat Products Coop
2014-07-26T00:00:00.0000000,Ecoato,Sweet Paprika Powder ,Salmonella,"TJX Companies, Inc."
2014-07-25T00:00:00.0000000,Rising Moon Organics,Butternut Squash Ravioli ,"Undeclared egg, milk and soy",Carmel Food Group
2014-07-25T00:00:00.0000000,CaCoCo Inc.,Drinking Chocolate “Original” and “Global Warrior” ,Salmonella,CaCoCo Inc.
2014-07-25T00:00:00.0000000,GoMacro,MacroBars ,Salmonella,GoMacro
2014-07-24T00:00:00.0000000,Tasty,Peach Slices ,Undeclared Sulfites,Lion Pavilion
2014-07-24T00:00:00.0000000,Dancing Star LLC and Rave Bites,Various snack products ,Salmonella,Dancing Star LLC
2014-07-24T00:00:00.0000000,Fresh Choices,Sandwiches ,Listeria monocytogenes,Great American Marketing
2014-07-23T00:00:00.0000000,Whole Foods,Made-in-Store items containing recalled fruit ,Listeria monocytogenes,Whole Foods Market
2014-07-22T00:00:00.0000000,Earth Circle Organics,Organic carob powder ,Salmonella,Earth Circle Organics
2014-07-21T00:00:00.0000000,American Health Packaging,"Ibuprofen Tablets, 600 mg & Oxcarbazepine Tablets, 300 mg ",mislabeled inner unit dose blister packaging,American Health Packaging
2014-07-21T00:00:00.0000000,Peony Mark Brand,Roasted and Salted Pumpkin Seeds ,Contains Undeclared Sulfites,Starway Incorporated
2014-07-20T00:00:00.0000000,"Wegmans Food Markets, Inc.",Baked desserts ,Listeria monocytogenes,"Wegmans Food Markets, Inc."
2014-07-19T00:00:00.0000000,Sweet 2 Eat and other store brands,"Whole peaches (white and yellow), nectarines (white and yellow), plums and pulots ",Listeria monocytogenes,Wawona Packing Company
2014-07-19T00:00:00.0000000,"Unique Pharmaceuticals, Ltd.",All sterile compounded preparations ,Lack of sterility assurance,"Unique Pharmaceuticals, Ltd."
